{
  "$schema": "https://json-schema.org/draft/2020-12/schema",
  "title": "FAIR Chef Repository Catalog Entry",
  "type": "object",
  "required": [
    "id",
    "name",
    "url",
    "source"
  ],
  "properties": {
    "id": {
      "type": "string"
    },
    "name": {
      "type": "string"
    },
    "alternate_names": {
      "type": "array",
      "items": {
        "type": "string"
      },
      "default": []
    },
    "url": {
      "type": "string"
    },
    "description": {
      "type": [
        "string",
        "null"
      ]
    },
    "contact": {
      "type": [
        "string",
        "null"
      ]
    },
    "repository_types": {
      "type": "array",
      "items": {
        "type": "string"
      },
      "default": []
    },
    "size": {
      "type": [
        "string",
        "null"
      ]
    },
    "start_date": {
      "type": [
        "string",
        "null"
      ]
    },
    "languages": {
      "type": "array",
      "items": {
        "type": "string"
      },
      "default": []
    },
    "subjects": {
      "type": "array",
      "items": {
        "type": "object",
        "required": [
          "value"
        ],
        "properties": {
          "value": {
            "type": "string"
          },
          "scheme": {
            "type": [
              "string",
              "null"
            ]
          }
        },
        "additionalProperties": false
      },
      "default": []
    },
    "mission_statement_url": {
      "type": [
        "string",
        "null"
      ]
    },
    "content_types": {
      "type": "array",
      "items": {
        "type": "string"
      },
      "default": []
    },
    "provider_types": {
      "type": "array",
      "items": {
        "type": "string"
      },
      "default": []
    },
    "keywords": {
      "type": "array",
      "items": {
        "type": "string"
      },
      "default": []
    },
    "institutions": {
      "type": "array",
      "items": {
        "type": "object",
        "required": [
          "name"
        ],
        "properties": {
          "name": {
            "type": "string"
          },
          "alternate_name": {
            "type": [
              "string",
              "null"
            ]
          },
          "country": {
            "type": [
              "string",
              "null"
            ]
          },
          "responsibilities": {
            "type": "array",
            "items": {
              "type": "string"
            },
            "default": []
          },
          "institution_type": {
            "type": [
              "string",
              "null"
            ]
          },
          "url": {
            "type": [
              "string",
              "null"
            ]
          },
          "identifiers": {
            "type": "array",
            "items": {
              "type": "string"
            },
            "default": []
          }
        },
        "additionalProperties": false
      },
      "default": []
    },
    "policies": {
      "type": "array",
      "items": {
        "type": "object",
        "properties": {
          "name": {
            "type": [
              "string",
              "null"
            ]
          },
          "url": {
            "type": [
              "string",
              "null"
            ]
          }
        },
        "additionalProperties": false
      },
      "default": []
    },
    "access": {
      "type": "object",
      "properties": {
        "database_access": {
          "type": "array",
          "items": {
            "type": "string"
          },
          "default": []
        },
        "data_access": {
          "type": "array",
          "items": {
            "type": "string"
          },
          "default": []
        },
        "data_upload": {
          "type": "array",
          "items": {
            "type": "string"
          },
          "default": []
        },
        "upload_restrictions": {
          "type": "array",
          "items": {
            "type": "string"
          },
          "default": []
        }
      },
      "additionalProperties": false,
      "default": {}
    },
    "licenses": {
      "type": "array",
      "items": {
        "type": "object",
        "properties": {
          "name": {
            "type": [
              "string",
              "null"
            ]
          },
          "url": {
            "type": [
              "string",
              "null"
            ]
          }
        },
        "additionalProperties": false
      },
      "default": []
    },
    "software": {
      "type": "array",
      "items": {
        "type": "string"
      },
      "default": []
    },
    "versioning": {
      "type": [
        "boolean",
        "null"
      ]
    },
    "apis": {
      "type": "array",
      "items": {
        "type": "object",
        "properties": {
          "type": {
            "type": [
              "string",
              "null"
            ]
          },
          "url": {
            "type": [
              "string",
              "null"
            ]
          }
        },
        "additionalProperties": false
      },
      "default": []
    },
    "persistent_identifier_systems": {
      "type": "array",
      "items": {
        "type": "string"
      },
      "default": []
    },
    "citation_guideline_url": {
      "type": [
        "string",
        "null"
      ]
    },
    "author_identifier_systems": {
      "type": "array",
      "items": {
        "type": "string"
      },
      "default": []
    },
    "enhanced_publication": {
      "type": [
        "boolean",
        "null"
      ]
    },
    "quality_management": {
      "type": [
        "string",
        "null"
      ]
    },
    "metadata_standards": {
      "type": "array",
      "items": {
        "type": "object",
        "properties": {
          "name": {
            "type": [
              "string",
              "null"
            ]
          },
          "url": {
            "type": [
              "string",
              "null"
            ]
          },
          "scheme": {
            "type": [
              "string",
              "null"
            ]
          }
        },
        "additionalProperties": false
      },
      "default": []
    },
    "remarks": {
      "type": [
        "string",
        "null"
      ]
    },
    "identifiers": {
      "type": "object",
      "properties": {
        "re3data_id": {
          "type": [
            "string",
            "null"
          ]
        },
        "repository_identifiers": {
          "type": "array",
          "items": {
            "type": "string"
          },
          "default": []
        }
      },
      "additionalProperties": false,
      "default": {}
    },
    "dates": {
      "type": "object",
      "properties": {
        "entry_date": {
          "type": [
            "string",
            "null"
          ]
        },
        "last_update": {
          "type": [
            "string",
            "null"
          ]
        }
      },
      "additionalProperties": false,
      "default": {}
    },
    "source": {
      "type": "object",
      "required": [
        "registry"
      ],
      "properties": {
        "registry": {
          "type": "string"
        },
        "xml_schema_version": {
          "type": [
            "string",
            "null"
          ]
        },
        "record_page": {
          "type": [
            "string",
            "null"
          ]
        },
        "api_endpoint": {
          "type": [
            "string",
            "null"
          ]
        }
      },
      "additionalProperties": false
    },
    "raw_source_record": {
      "type": [
        "object",
        "null"
      ]
    },
    "custom": {
      "type": "object",
      "default": {}
    }
  },
  "additionalProperties": false
}