{
  "id": "r3d100010924",
  "name": "OpenNeuro",
  "alternate_names": [
    "formerly: OpenfMRI"
  ],
  "url": "https://openneuro.org/",
  "description": "The OpenNeuro project (formerly known as the OpenfMRI project) was established in 2010 to provide a resource for researchers interested in making their neuroimaging data openly available to the research community. It is managed by Russ Poldrack and Chris Gorgolewski of the Center for Reproducible Neuroscience at Stanford University. The project has been developed with funding from the National Science Foundation, National Institute of Drug Abuse, and the Laura and John Arnold Foundation.",
  "contact": "support@openneuro.freshdesk.com",
  "repository_types": [
    "disciplinary"
  ],
  "size": "1.590 public datasets",
  "start_date": "2010",
  "languages": [
    "eng"
  ],
  "subjects": [
    {
      "value": "1 Humanities and Social Sciences",
      "scheme": "DFG"
    },
    {
      "value": "110 Psychology",
      "scheme": "DFG"
    },
    {
      "value": "12 Social and Behavioural Sciences",
      "scheme": "DFG"
    },
    {
      "value": "2 Life Sciences",
      "scheme": "DFG"
    },
    {
      "value": "201 Basic Biological and Medical Research",
      "scheme": "DFG"
    },
    {
      "value": "20101 Biochemistry",
      "scheme": "DFG"
    },
    {
      "value": "206 Neurosciences",
      "scheme": "DFG"
    },
    {
      "value": "20606 Cognitive Neuroscience and Neuroimaging",
      "scheme": "DFG"
    },
    {
      "value": "21 Biology",
      "scheme": "DFG"
    },
    {
      "value": "22 Medicine",
      "scheme": "DFG"
    }
  ],
  "mission_statement_url": "https://docs.openneuro.org/faq",
  "content_types": [
    "Archived data",
    "Images",
    "Plain text",
    "Raw data"
  ],
  "provider_types": [
    "dataProvider"
  ],
  "keywords": [
    "behavioral scientists",
    "biology",
    "brain",
    "brain chemistry",
    "cells",
    "magnetic resonance imaging",
    "molecular biology",
    "stimulants"
  ],
  "institutions": [
    {
      "name": "National Science Foundation",
      "alternate_name": "NSF",
      "country": "USA",
      "responsibilities": [
        "funding"
      ],
      "institution_type": "non-profit",
      "url": "https://www.nsf.gov/",
      "identifiers": [
        "ROR:021nxhr62",
        "RRID:SCR_012938"
      ]
    },
    {
      "name": "Stanford University, Poldrack Lab",
      "alternate_name": null,
      "country": "USA",
      "responsibilities": [
        "general"
      ],
      "institution_type": "non-profit",
      "url": "https://www.poldracklab.org/",
      "identifiers": []
    },
    {
      "name": "University of Texas, Texas Advanced Computing Center",
      "alternate_name": "TACC",
      "country": "USA",
      "responsibilities": [
        "technical"
      ],
      "institution_type": "non-profit",
      "url": "https://tacc.utexas.edu/",
      "identifiers": [
        "ROR:00xg4bh43",
        "RRID:SCR_012530"
      ]
    }
  ],
  "policies": [
    {
      "name": "OpenNeuro FAQ",
      "url": "https://docs.openneuro.org/faq"
    }
  ],
  "access": {
    "database_access": [
      "open"
    ],
    "data_access": [
      "embargoed",
      "open",
      "restricted"
    ],
    "data_upload": [
      "restricted"
    ],
    "upload_restrictions": [
      "registration"
    ]
  },
  "licenses": [
    {
      "name": "CC",
      "url": "https://creativecommons.org/licenses/by/3.0/de/"
    },
    {
      "name": "CC0",
      "url": "https://creativecommons.org/publicdomain/zero/1.0/"
    },
    {
      "name": "Copyrights",
      "url": "https://docs.openneuro.org/faq"
    },
    {
      "name": "ODC",
      "url": "https://www.opendatacommons.org/licenses/pddl/1.0/"
    }
  ],
  "software": [
    "other"
  ],
  "versioning": true,
  "apis": [
    {
      "type": "REST",
      "url": "https://openneuro.org/crn/graphql"
    }
  ],
  "persistent_identifier_systems": [
    "DOI"
  ],
  "citation_guideline_url": "https://docs.openneuro.org/faq",
  "author_identifier_systems": [
    "ORCID"
  ],
  "enhanced_publication": false,
  "quality_management": null,
  "metadata_standards": [
    {
      "name": "ABCD - Access to Biological Collection Data",
      "url": "http://www.dcc.ac.uk/resources/metadata-standards/abcd-access-biological-collection-data",
      "scheme": "DCC"
    }
  ],
  "remarks": "is covered by Elsevier. OpenNeuro is covered by Clarivate Data Citation Index. OpenNeuro represents the next step beyond the OpenfMRI data sharing platform. The name change is meant to reflect the fact that they are no longer focused exclusively on fMRI — the new platform will accept any imaging dataset that follows the BIDS standard. http://reproducibility.stanford.edu/announcing-the-openneuro-platform-open-and-reproducible-science-as-a-service/",
  "identifiers": {
    "re3data_id": "r3d100010924",
    "repository_identifiers": [
      "10.25504/FAIRsharing.s1r9bw",
      "SCR_005031",
      "nlx_144048"
    ]
  },
  "dates": {
    "entry_date": "2014-08-26",
    "last_update": "2026-01-19"
  },
  "source": {
    "registry": "re3data",
    "xml_schema_version": "2.2",
    "record_page": "https://www.re3data.org/repository/r3d100010924",
    "api_endpoint": "https://www.re3data.org/api/v1/repository/r3d100010924"
  },
  "raw_source_record": {